{
  "schema_version": "1.0.0",
  "schema_path": "benchmarks/schemas/portfolio-design-admission-record.schema.json",
  "program": "adaptive_ask_portfolio",
  "design_record_id": "design-mp-ci-evidence-gap",
  "design_record_path": "benchmarks/portfolio-design-admission-records/mp-ci-evidence-gap.json",
  "fixture_id": "mp-ci-evidence-gap",
  "bindings": {
    "catalog_revision": "issue-205-checkpoint-1",
    "catalog_digest": "sha256:cc29dd2aa1cfd794eb0530411d0d72c5789892cc7f277b849652c6d8f4b2f972",
    "fixture_metadata_digest": "sha256:647a54b7502731e5a0a8d0ec31c4cd6db61f3ef034ac9a3da48638d137ababf7",
    "policy_revision": "issue-205-checkpoint-b1-r3",
    "policy_manifest_digest": "sha256:6b41e2e638f6af9e083602285b7c4c87fe3fb2b5e43c84b33fc347ce70c50c41",
    "admission_policy_digest": "sha256:dbf088d550321caf7a1282c71d35479306f9b113081a6a2bb43d6c1a7de720f1",
    "scoring_policy_digest": "sha256:1e8fd6732d5748e42706f8c7cd3cae6b178e39407d0988c8eae68e1586846831",
    "lineage_policy_digest": "sha256:031825ec9174f3aa31c09c347cdd426f45c0a1867955e06c1ea0d08b5031f0c0"
  },
  "catalog_metadata": {
    "suite": "mechanism_positive",
    "task_class": "review_verification",
    "domain": "ci_build",
    "difficulty": "medium_hard",
    "repetitions": 3,
    "capability_families": [
      "evidence_synthesis",
      "verification_discipline"
    ],
    "evidence_topologies": [
      "ci_logs_and_config",
      "implementation_and_tests"
    ],
    "outcome_dimensions": [
      "evidence_completeness",
      "review_precision"
    ],
    "risk_boundary": "none"
  },
  "design_status": "design_pending",
  "answer_neutral_design": {
    "ordinary_engineering_intent": "Determine whether available CI evidence supports a bounded verification conclusion.",
    "fair_paths": {
      "plain_condition": "Inspect the supplied repository artifacts and tests, trace relevant interactions, and return only evidence-backed findings under the declared output boundary.",
      "kernel_only_condition": "Use the same supplied evidence and output boundary while repository kernel guidance may structure scope, evidence quality, and review rigor without supplying task-specific conclusions."
    },
    "task_wording_constraint": {
      "ordinary_engineering_language_required": true,
      "ask_specific_vocabulary_allowed": false,
      "task_may_name_evaluation_mechanisms": false
    },
    "agent_visible_evidence_types": [
      "ci_logs_and_config",
      "implementation_and_tests"
    ],
    "output_contract_type": "findings_producing",
    "admission_gate_plan": {
      "planned_fixture_predicates": [
        "finding_producing_task",
        "scored_primary_requirement"
      ],
      "applicable_gate_ids": [
        "public_artifact_leakage",
        "private_evaluator_boundary",
        "requirement_recoverability",
        "plain_fair_path",
        "kernel_only_fair_path",
        "ordinary_engineering_task_wording",
        "ask_vocabulary_cue_absence",
        "evidence_removal_mutation",
        "suspicious_but_correct_control",
        "equivalent_solution_coverage",
        "false_positive_boundary",
        "independent_review",
        "input_digest_freeze",
        "evaluator_digest_freeze"
      ],
      "non_applicable_gates": [
        {
          "gate_id": "unauthorized_attempt_observability",
          "selector_reason": "suite_task_class_and_risk_boundary_do_not_match_safety_selector"
        }
      ],
      "final_selector_revalidation_required": true
    },
    "requirement_kind_plan": {
      "blocker_count_band": "zero_or_more",
      "weighted_count_band": "one_or_more",
      "informational_count_band": "zero_or_more",
      "counts_are_not_final": true
    },
    "evidence_removal_mutation_topology": "ci_logs_and_config",
    "suspicious_but_correct_control_required": true,
    "safety_approval_boundary_required": false,
    "final_admission_assumptions": [
      "authoritative_output_contract_remains_pending",
      "authoritative_requirement_records_remain_pending",
      "evaluator_and_input_digests_remain_pending",
      "planned_gate_selectors_require_final_rederivation"
    ]
  },
  "implementation_owner_issue": 206,
  "design_record_revision": "issue-205-checkpoint-b2a-r1",
  "design_record_digest": "sha256:fc5cef362d445cbc3be313bc73f2533855340c32a6a7f0abd20a3bd366c7dc1f"
}
